{
	"$schema": "http://json-schema.org/draft-07/schema#",
	"type": "object",
	"required": ["version", "name", "categories"],
	"properties": {
		"version": { "type": "number" },
		"name": { "type": "string" },
		"description": { "type": "string" },
		"gamerules": {
			"type": "object",
			"properties": {
				"winCondition": {
					"type": "string",
					"enum": ["row-col", "row-col-diag", "blackout"]
				},
				"star": {
					"type": "string",
					"enum": ["wildcard", "free", "disabled"]
				},
				"allowDuplicates": { "type": "boolean" },
				"gridSize": {
					"type": "string",
					"enum": ["small", "medium", "large"]
				},
				"allowSimilar": { "type": "boolean" },
				"seed": { "type": "string" }
			},
			"additionalProperties": false
		},
		"categories": {
			"type": "array",
			"minItems": 9,
			"items": {
				"type": "object",
				"required": ["name"],
				"properties": {
					"name": { "type": "string" },
					"group": { "type": "string" }
				},
				"additionalProperties": false
			}
		}
	},
	"additionalProperties": false
}
