{
	"version": 1,
	"name": "Form",
	"description": "A genre list for diverse forms of gameplay.",
	"categories": [
		{ "name": "ARPG", "group": "RPG" },
		{ "name": "CRPG", "group": "RPG" },
		{ "name": "Dungeon crawler", "group": "RPG" },
		{ "name": "JRPG", "group": "RPG" },
		{ "name": "Tactical RPG", "group": "RPG" },
		{ "name": "Card game", "group": "Cards" },
		{ "name": "Collectible card game", "group": "Cards" },
		{ "name": "Deckbuilding", "group": "Cards" },
		{ "name": "Digital tabletop game", "group": "Cards" },
		{ "name": "Indoor sports", "group": "Sports" },
		{ "name": "Summer sports", "group": "Sports" },
		{ "name": "Winter sports", "group": "Sports" },
		{ "name": "2D platformer" },
		{ "name": "3D platformer" },
		{ "name": "Action-adventure" },
		{ "name": "Arcade racing" },
		{ "name": "Autobattler" },
		{ "name": "Base building" },
		{ "name": "Battle royale" },
		{ "name": "Beat 'em up" },
		{ "name": "Arena/boomer shooter" },
		{ "name": "Bullet heaven" },
		{ "name": "Bullet hell" },
		{ "name": "Casual" },
		{ "name": "City builder" },
		{ "name": "Collectathon" },
		{ "name": "Combat racing" },
		{ "name": "Comedy" },
		{ "name": "Cozy" },
		{ "name": "Creature collector" },
		{ "name": "Dating sim" },
		{ "name": "Driving/piloting" },
		{ "name": "Educational" },
		{ "name": "Escape room" },
		{ "name": "Experimental" },
		{ "name": "Exploration" },
		{ "name": "Fighting" },
		{ "name": "FPS" },
		{ "name": "God game" },
		{ "name": "Grand strategy/4X" },
		{ "name": "Hack and slash" },
		{ "name": "Hidden object" },
		{ "name": "Horror" },
		{ "name": "Idle/incremental/clicker" },
		{ "name": "Immersive sim" },
		{ "name": "Interactive fiction" },
		{ "name": "Job simulator" },
		{ "name": "Life sim" },
		{ "name": "Logic" },
		{ "name": "Looter shooter" },
		{ "name": "Management" },
		{ "name": "Match 3" },
		{ "name": "Metroidvania/search action" },
		{ "name": "Military/realistic shooter" },
		{ "name": "Mining" },
		{ "name": "Mystery/investigation" },
		{ "name": "On-rails shooter" },
		{ "name": "Parkour" },
		{ "name": "Physics" },
		{ "name": "Point & click adventure" },
		{ "name": "Political sim" },
		{ "name": "Programming" },
		{ "name": "Puzzle" },
		{ "name": "Puzzle platformer" },
		{ "name": "Real-time strategy/tactics" },
		{ "name": "Rhythm" },
		{ "name": "Roguelike" },
		{ "name": "Run and gun" },
		{ "name": "Runner" },
		{ "name": "Sandbox" },
		{ "name": "Score attack" },
		{ "name": "Shoot 'em up" },
		{ "name": "Shop keeper" },
		{ "name": "Sim racing" },
		{ "name": "Soulslike" },
		{ "name": "Stealth" },
		{ "name": "Survival" },
		{ "name": "Survival horror" },
		{ "name": "Tactical shooter" },
		{ "name": "Third-person shooter" },
		{ "name": "Time attack" },
		{ "name": "Time management" },
		{ "name": "Top-down shooter" },
		{ "name": "Tower defense" },
		{ "name": "Turn-based strategy/tactics" },
		{ "name": "Twin-stick shooter" },
		{ "name": "Typing" },
		{ "name": "Vehicle sim" },
		{ "name": "Vehicular combat" },
		{ "name": "Visual novel" },
		{ "name": "Walking simulator" },
		{ "name": "Word game" }
	]
}
