{
	"version": 1,
	"name": "Tildes Backlog Burner - May 2025 Flow",
	"description": "A conceptually abstract list of ideas to guide you.  Let your imagination flow.",
	"categories": [
		{ "name": "Absence" },
		{ "name": "Abundance" },
		{ "name": "Adaptation" },
		{ "name": "Aesthetic" },
		{ "name": "Annihilation" },
		{ "name": "Ascent" },
		{ "name": "Balance" },
		{ "name": "Beauty" },
		{ "name": "Belonging" },
		{ "name": "Bizarre" },
		{ "name": "Brief" },
		{ "name": "Bright" },
		{ "name": "Calm" },
		{ "name": "Causality" },
		{ "name": "Change" },
		{ "name": "Chaos" },
		{ "name": "Choice" },
		{ "name": "Collaboration" },
		{ "name": "Color" },
		{ "name": "Comfortable" },
		{ "name": "Community" },
		{ "name": "Complexity" },
		{ "name": "Conflict" },
		{ "name": "Connection" },
		{ "name": "Contemplative" },
		{ "name": "Contrast" },
		{ "name": "Courage" },
		{ "name": "Creativity" },
		{ "name": "Curiosity" },
		{ "name": "Darkness" },
		{ "name": "Deception" },
		{ "name": "Defense" },
		{ "name": "Destruction" },
		{ "name": "Dimension" },
		{ "name": "Discovery" },
		{ "name": "Distribution" },
		{ "name": "Duality" },
		{ "name": "Emergence" },
		{ "name": "Empathy" },
		{ "name": "Endurance" },
		{ "name": "Erosion" },
		{ "name": "Evolution" },
		{ "name": "Expansive" },
		{ "name": "Exploration" },
		{ "name": "Faith" },
		{ "name": "Familiar" },
		{ "name": "Fear" },
		{ "name": "Fight" },
		{ "name": "Flashy" },
		{ "name": "Fleeting" },
		{ "name": "Focus" },
		{ "name": "Fragmentation" },
		{ "name": "Freedom" },
		{ "name": "Frenetic" },
		{ "name": "Friction" },
		{ "name": "Gentle" },
		{ "name": "Gradual" },
		{ "name": "Growth" },
		{ "name": "Happiness" },
		{ "name": "Harmony" },
		{ "name": "Humor" },
		{ "name": "Identity" },
		{ "name": "Increment" },
		{ "name": "Isolation" },
		{ "name": "Justice" },
		{ "name": "Knowledge" },
		{ "name": "Legacy" },
		{ "name": "Light" },
		{ "name": "Lost" },
		{ "name": "Love" },
		{ "name": "Maneuver" },
		{ "name": "Memory" },
		{ "name": "Momentum" },
		{ "name": "Morality" },
		{ "name": "Mystery" },
		{ "name": "Niche" },
		{ "name": "Nostalgia" },
		{ "name": "Open" },
		{ "name": "Order" },
		{ "name": "Organic" },
		{ "name": "Organization" },
		{ "name": "Peace" },
		{ "name": "Perspective" },
		{ "name": "Power" },
		{ "name": "Precision" },
		{ "name": "Pride" },
		{ "name": "Progress" },
		{ "name": "Quantity" },
		{ "name": "Rebirth" },
		{ "name": "Recursion" },
		{ "name": "Reluctance" },
		{ "name": "Repetition" },
		{ "name": "Resistance" },
		{ "name": "Restoration" },
		{ "name": "Silence" },
		{ "name": "Simple" },
		{ "name": "Simplicity" },
		{ "name": "Slow-burn" },
		{ "name": "Sly" },
		{ "name": "Sound" },
		{ "name": "Style" },
		{ "name": "Survival" },
		{ "name": "Swift" },
		{ "name": "Symmetry" },
		{ "name": "Synthesis" },
		{ "name": "Tense" },
		{ "name": "Tension" },
		{ "name": "Threshold" },
		{ "name": "Time" },
		{ "name": "Tradition" },
		{ "name": "Traditional" },
		{ "name": "Transformation" },
		{ "name": "Treasure" },
		{ "name": "Trust" },
		{ "name": "Truth" },
		{ "name": "Uncertainty" },
		{ "name": "Unexpected" },
		{ "name": "Unlock" },
		{ "name": "Unorthodox" },
		{ "name": "Variety" },
		{ "name": "Verticality" },
		{ "name": "Vision" },
		{ "name": "Vulnerability" },
		{ "name": "Whimsy" },
		{ "name": "Wonder" }
	]
}
