{
	"version": 1,
	"name": "Tildes Backlog Burner - May 2024",
	"description": "The first major category overhaul.",
	"categories": [
		{ "name": "Has less than NUMBER[2,20] achievements", "group": "Achievements" },
		{ "name": "Has more than NUMBER[50,100] achievements", "group": "Achievements" },
		{ "name": "Has no achievements", "group": "Achievements" },
		{ "name": "You can't remember where you got it from", "group": "Acquisition" },
		{ "name": "You got from a bundle", "group": "Acquisition" },
		{ "name": "You got it as a gift", "group": "Acquisition" },
		{ "name": "You got it from crowdfunding", "group": "Acquisition" },
		{ "name": "You own it on physical media", "group": "Acquisition" },
		{ "name": "You regret buying it", "group": "Acquisition" },
		{ "name": "Nominated for CHOOSE[a GDC Award|a Steam award|The Game Awards|any award]" },
		{ "name": "Has CHOOSE[a female|a robot|an animal|a non-human] antagonist", "group": "Characters" },
		{ "name": "Has CHOOSE[a female|a robot|an animal|a non-human|a silent] protagonist", "group": "Characters" },
		{ "name": "Has romanceable characters", "group": "Characters" },
		{ "name": "Multiple playable characters", "group": "Characters" },
		{ "name": "You can create your own character", "group": "Characters" },
		{ "name": "You control a party of characters", "group": "Characters" },
		{ "name": "You got it CHOOSE[for free|on sale|at full price]" },
		{ "name": "A solo-dev project" },
		{ "name": "An updated version (remake, re-release) of an older game" },
		{ "name": "From a different country than you" },
		{ "name": "From a studio you haven't heard of before" },
		{ "name": "From now-defunct dev studio" },
		{ "name": "Is open-source" },
		{ "name": "Has been removed from a distribution service", "group": "Distribution" },
		{ "name": "Is considered “abandonware”", "group": "Distribution" },
		{ "name": "Not found on any distribution service", "group": "Distribution" },
		{ "name": "On a platform you don’t normally use", "group": "Distribution" },
		{ "name": "Has CHOOSE[campaign|no|cosmetic|season pass] DLC" },
		{ "name": "Adaptation of other media type (e.g. board game, movie)" },
		{ "name": "Features a mystery" },
		{ "name": "Focuses on exploration" },
		{ "name": "Focuses on relationships" },
		{ "name": "Has a branching storyline" },
		{ "name": "Has a fishing minigame" },
		{ "name": "Has a lives system" },
		{ "name": "Has a moral choice system" },
		{ "name": "Has a skill tree" },
		{ "name": "Has a time limit" },
		{ "name": "Has a weather system" },
		{ "name": "Has both combat and puzzles" },
		{ "name": "Has CHOOSE[aliens|dinosaurs|robots|AI|cats|dogs|zombies]" },
		{ "name": "Has driving" },
		{ "name": "Has gravity manipulation" },
		{ "name": "Has permadeath" },
		{ "name": "Has survival mechanics" },
		{ "name": "Has time manipulation" },
		{ "name": "Has/uses cards" },
		{ "name": "Is beatable without killing any enemies" },
		{ "name": "Is mostly text-based" },
		{ "name": "Light and dark play a role" },
		{ "name": "Music/rhythm-focused" },
		{ "name": "Randomness determines your fate" },
		{ "name": "Uses a unique control scheme" },
		{ "name": "Uses at most three buttons" },
		{ "name": "Uses procedural generation" },
		{ "name": "You can save/pet/care for animals" },
		{ "name": "Came out more than NUMBER[2,10] years ago" },
		{ "name": "Is one of the oldest games you own" },
		{ "name": "Has a campaign longer than NUMBER[5,15] hours", "group": "Game Time" },
		{ "name": "You can complete it in one sitting", "group": "Game Time" },
		{ "name": "You can complete it in only a few hours", "group": "Game Time" },
		{ "name": "Chosen for you by someone else" },
		{ "name": "Recommended by someone IRL" },
		{ "name": "Your friend loves it" },
		{ "name": "Has a review score above NUMBER[80,95]", "group": "Review Score" },
		{ "name": "Has a review score below NUMBER[55,70]", "group": "Review Score" },
		{ "name": "From a series you CHOOSE[have|have never] played", "group": "Series" },
		{ "name": "Part of a long-running series", "group": "Series" },
		{ "name": "Part of a trilogy", "group": "Series" },
		{ "name": "Set CHOOSE[in a post-apocalyptic world|in a real world location|in a fantasy world|in space|in a dungeon|in a historical world|underwater]" },
		{ "name": "Considered a CHOOSE[classic|cult classic|disappointment]" },
		{ "name": "From a different culture or country" },
		{ "name": "Has been banned, censored, or challenged" },
		{ "name": "Known for its CHOOSE[difficulty|soundtrack|composer|art style|ending|replay value|legacy|impact on gaming|real-world drama]" },
		{ "name": "CHOOSE[Begins with the first letter of|Same number of letters as] your username" },
		{ "name": "Recommended by someone on Tildes" },
		{ "name": "Released in the year you joined Tildes" },
		{ "name": "Someone else has played it for their Backlog Burner" },
		{ "name": "You heard about it in our weekly gaming topics" },
		{ "name": "Has CHOOSE[“Super”|a number|punctuation|the letter ‘Q’|the letter ‘X'] in the title" },
		{ "name": "You chose it based on title alone" },
		{ "name": "Has a CHOOSE[feel-good|spooky|moody|humorous|cozy|lonely|relaxing|futuristic|surreal|experimental|philosophical|satirical|unsettling|whimsical] vibe" },
		{ "name": "“When the hell did I buy this?”" },
		{ "name": "Owned for more than NUMBER[2,7] years" },
		{ "name": "A modded game" },
		{ "name": "A romhack or total conversion mod" },
		{ "name": "From a genre you don’t normally play" },
		{ "name": "From a genre you find challenging" },
		{ "name": "Great reviews, but not your usual type" },
		{ "name": "Has environmental storytelling" },
		{ "name": "It’s already installed" },
		{ "name": "Popular game you never got around to playing" },
		{ "name": "Released before you were born" },
		{ "name": "You don't think you'll enjoy it" },
		{ "name": "You have to tinker to get it running" },
		{ "name": "You started it but never completed it" },
		{ "name": "You wanted it when you were younger" },
		{ "name": "You're giving it a second chance" }
	]
}
